{
  "$schema": "https://json-schema.org/draft/2020-12/schema",
  "$id": "https://mdbase.dev/schemas/runtime/v0.1/event-envelope.schema.json",
  "title": "mdbase runtime event envelope",
  "type": "object",
  "required": ["type", "contract_version", "id", "occurred_at", "source", "payload"],
  "properties": {
    "type": {
      "$ref": "#/$defs/identifier"
    },
    "contract_version": {
      "type": "integer",
      "minimum": 1
    },
    "id": {
      "$ref": "#/$defs/identifier"
    },
    "occurred_at": {
      "type": "string",
      "format": "date-time"
    },
    "source": {
      "type": "object",
      "required": ["runtime"],
      "properties": {
        "runtime": {
          "$ref": "#/$defs/identifier"
        },
        "provider": {
          "$ref": "#/$defs/identifier"
        },
        "collection": {
          "type": "string"
        }
      },
      "patternProperties": {
        "^x-[A-Za-z0-9._:-]+$": true
      },
      "additionalProperties": false
    },
    "payload": {
      "type": "object",
      "additionalProperties": true
    },
    "trace": {
      "type": "object",
      "properties": {
        "correlation_id": {
          "$ref": "#/$defs/identifier"
        },
        "causation_id": {
          "$ref": "#/$defs/identifier"
        }
      },
      "patternProperties": {
        "^x-[A-Za-z0-9._:-]+$": true
      },
      "additionalProperties": false
    }
  },
  "additionalProperties": false,
  "$defs": {
    "identifier": {
      "type": "string",
      "pattern": "^[A-Za-z][A-Za-z0-9._:-]*$"
    }
  }
}
